skills,career
python analytics seaborn visualization sklearn matplotlib,Data Scientist
communication media publicrelations branding,Public Relations Manager
psychology therapy mentalhealth,Psychologist
management analysis investment finance portfolio,Financial Analyst
interior planning design,Interior Designer
management strategy operations,Operations Manager
projectmanagement planning leadership agile,Project Manager
animation design visual,Animator
communication reporting journalism,Journalist
psychology mentalhealth therapy,Psychologist
roadmap agile planning scrum product,Product Manager
planning scrum roadmap agile product,Product Manager
game design unreal 3d c++,Game Developer
training hr recruitment management hiring,HR Manager
communication targets sales presentation negotiation,Marketing Manager
networking tcpip switching routing,Network Engineer
argument legal court law,Lawyer
optimization operations supplychain,Operations Manager
litigation law legalwriting,Lawyer
linux networking cybersecurity firewall ethicalhacking security,Cybersecurity Analyst
negotiation leadgeneration closing deals sales,Sales Manager
strategy product stakeholder roadmap agile,Product Manager
innovation strategy business,Entrepreneur
monitoring cloud ec2 s3 iam aws,Cloud Engineer
hospitality service management,Hotel Manager
event management coordination,Event Manager
planning supplychain logistics,Supply Chain Manager
employee relations policies hr training,HR Manager
ml preprocessing analytics data python pandas,Machine Learning Engineer
management inventory supplychain,Supply Chain Manager
mobile ui apps reactnative javascript,Mobile App Developer
prototype figma wireframe uiux design,UI UX Designer
customer hospitality management,Hotel Manager
strategy business innovation,Entrepreneur
planning logistics operations,Supply Chain Manager
innovation business strategy,Entrepreneur
law negotiation contracts,Lawyer
analysis news reporting,Journalist
statistics economics dataanalysis,Economist
backend javascript html sql flask css,Full Stack Developer
r visualization statistics analytics dataanalysis modeling,Data Scientist
python docker api flask postgresql backend,Backend Developer
analysis economicresearch policy,Economist
statistics dataanalysis economics,Economist
branding illustrator photoshop design creativity,Graphic Designer
project planning communication leadership,Project Manager
training employee hr engagement management,HR Manager
blogging writing editing creation content,Content Writer
devops pipeline jenkins automation docker cloud,Cloud Engineer
support problem communication,Customer Support Specialist
law legalresearch litigation contracts,Lawyer
communication customerservice,Customer Support Specialist
seo marketing socialmedia campaign,Digital Marketing Specialist
studio android java mobile development apps,Mobile App Developer
growth traffic seo analytics,SEO Specialist
database administration oracle security,Database Administrator
airflow pipeline python etl dataengineering,Data Engineer
web3 ethereum smartcontracts solidity,Blockchain Developer
debugging systems c++ optimization memory programming pointers,Software Engineer
datastructures dsa python programming oop debugging algorithms,Software Engineer
campaign seo socialmedia marketing,Digital Marketing Specialist
strategy planning marketresearch development product,Product Manager
python ai tensorflow deeplearning machinelearning,AI Engineer
investment finance modeling excel riskanalysis,Financial Analyst
talent hr hiring recruitment acquisition,HR Manager
sklearn matplotlib seaborn analytics python visualization,Data Scientist
graphics illustrator logo design branding,Graphic Designer
writing media news,Journalist
optimization operations supplychain,Operations Manager
terraform docker devops aws cloud linux kubernetes,Cloud Engineer
management supplychain inventory,Supply Chain Manager
planning leadership agile projectmanagement,Project Manager
backend django authentication api sql python,Backend Developer
creativity gamedesign concept,Game Designer
relations sales customer strategy marketing,Sales Manager
management training hiring hr recruitment,HR Manager
content creation blogging editing writing,Content Writer
development product marketresearch strategy planning,Product Manager
blockchain solidity ethereum smartcontracts,Blockchain Developer
machinelearning python tensorflow ai deeplearning,AI Engineer
design animation storyboard,Animator
blockchain smartcontracts solidity ethereum,Blockchain Developer
spaceplanning decor design,Interior Designer
research dataanalysis report,Research Analyst
recruitment hr hiring management training,HR Manager
javascript flask sql backend css html,Full Stack Developer
analytics productplanning management strategy roadmap,Product Manager
accounting tally taxation finance auditing,Banking Officer
network infrastructure wan lan,Network Engineer
api fullstack express nodejs react mongodb,Full Stack Developer
presentation sales communication targets negotiation,Marketing Manager
excel modeling investment finance riskanalysis,Financial Analyst
businessdevelopment sales negotiation strategy,Sales Manager
planning customer travel,Travel Consultant
html css bootstrap javascript figma design,Frontend Developer
behavior counselling therapy psychology,Psychologist
relations strategy customer sales marketing,Sales Manager
management hotel operations,Hotel Manager
analytics seo content keywords,SEO Specialist
unity ui c# animation game,Game Developer
routing switching networking tcpip,Network Engineer
documentation analysis stakeholder requirements communication,Business Analyst
algorithms programming oop python datastructures debugging dsa,Software Engineer
deployment cloud jenkins automation docker pipeline,DevOps Engineer
recruitment hr management performance training,HR Manager
planning agile projectmanagement leadership,Project Manager
debugging systems optimization c++ memory pointers programming,Software Engineer
animation 3d modeling,Animator
monitoring analysis linux security penetrationtesting,Cybersecurity Analyst
levels game design,Game Designer
teaching education classroom,Teacher
modeling analytics dataanalysis visualization r statistics,Data Scientist
web3 blockchain solidity defi crypto,Blockchain Developer
economics forecasting analysis,Economist
cyberlaw ethicalhacking kali linux security,Cybersecurity Analyst
psychology therapy mentalhealth,Psychologist
game graphics development c# unity,Game Developer
mysql sql optimization database performance,Database Administrator
systems debugging versioncontrol linux git docker,Software Engineer
supplychain inventory management,Supply Chain Manager
collections oop java backend jdbc spring multithreading,Software Engineer
css bootstrap html design javascript figma,Frontend Developer
c++ optimization systems programming pointers memory debugging,Software Engineer
ai modeling python sklearn ml algorithms,Machine Learning Engineer
portfolio financialanalysis investment risk banking,Banking Officer
logistics planning supplychain,Supply Chain Manager
communication organization event,Event Manager
api backend systems concurrency golang microservices,Software Engineer
animation game c# unity ui,Game Developer
seo content marketing googleanalytics,SEO Specialist
graphics c++ development game engine,Game Developer
illustrator graphics logo design branding,Graphic Designer
python deeplearning tensorflow ai neuralnetworks keras,Data Scientist
illustrator design branding logo graphics,Graphic Designer
riskanalysis excel investment banking finance,Banking Officer
design wireframe uiux prototype interaction,UI UX Designer
analysis requirements documentation stakeholder communication,Business Analyst
blockchain security crypto web3,Blockchain Developer
security cyberlaw ethicalhacking kali linux,Cybersecurity Analyst
riskanalysis investment banking excel finance,Banking Officer
prototype design uiux wireframe interaction,UI UX Designer
editing video creativity,Video Editor
devops cloud terraform ci/cd automation pipeline,DevOps Engineer
processing spark hadoop bigdata etl data,Data Engineer
projectmanagement planning agile leadership,Project Manager
python ai neuralnetworks modeltraining tensorflow,AI Engineer
typography poster layout canva creativity,Graphic Designer
docker deployment pipeline jenkins automation cloud,DevOps Engineer
financialanalysis finance banking investment portfolio,Financial Analyst
keywords seo content analytics,SEO Specialist
news media writing,Journalist
psychology mentalhealth therapy,Psychologist
report research dataanalysis,Research Analyst
ai transformers python pytorch nlp,AI Engineer
finance financial valuation investment analysis,Financial Analyst
python oop datastructures algorithms programming debugging dsa,Software Engineer
sass design frontend responsive ui react,Frontend Developer
sales communication targets presentation negotiation,Sales Manager
targets marketing salesstrategy communication,Sales Manager
event planning logistics,Event Manager
lan infrastructure wan network,Network Engineer
javascript css uiux html react responsive,Frontend Developer
operations supplychain optimization,Operations Manager
css bootstrap javascript design figma html,Frontend Developer
web3 blockchain security crypto,Blockchain Developer
javascript vue axios api css frontend,Frontend Developer
procurement logistics supplychain,Supply Chain Manager
communication service support,Customer Support Specialist
analysis behavior psychology,Psychologist
argument court law legal,Lawyer
businessdevelopment sales negotiation strategy,Sales Manager
visual photography editing,Photographer
caseanalysis legalresearch law,Lawyer
analysis valuation financial investment finance,Financial Analyst
strategy customer sales relations marketing,Sales Manager
reporting writing journalism news,Journalist
frontend nodejs fullstack react javascript sql,Full Stack Developer
datawarehouse python hadoop spark sql etl,Data Engineer
logistics supplychain planning,Supply Chain Manager
analysis valuation finance investment financial,Financial Analyst
education planning curriculum teaching,Teacher
planning logistics operations,Supply Chain Manager
branding communication publicrelations media,Public Relations Manager
relations hr policies employee training,HR Manager
management performance recruitment training hr,HR Manager
communication publicrelations marketing,Public Relations Manager
usability designthinking figma uiux research,UI UX Designer
leadership communication project planning,Project Manager
security ethicalhacking kali linux cyberlaw,Cybersecurity Analyst
photography camera editing,Photographer
planning marketresearch development strategy product,Product Manager
strategy sales negotiation businessdevelopment,Sales Manager
coordination event management,Event Manager
design animation visual,Animator
devops automation ci/cd pipeline cloud terraform,DevOps Engineer
customer management hospitality,Hotel Manager
seo editing writing blogging contentstrategy,Content Writer
performance mysql optimization sql database,Database Administrator
automation linux scripting monitoring devops infrastructure,DevOps Engineer
dart mobile development flutter ui apps,Mobile App Developer
media reporting investigation,Journalist
marketing communication publicrelations,Public Relations Manager
security administration database oracle,Database Administrator
oracle administration security database,Database Administrator
c++ unreal 3d design game,Game Developer
investigation media reporting,Journalist
editing videoediting premiere,Video Editor
programming memory debugging optimization c++ pointers systems,Software Engineer
storytelling writing editing blogging article,Content Writer
service support customer,Customer Support Specialist
management hospitality service,Hotel Manager
operations finance compliance banking services,Banking Officer
media communication reputation,Public Relations Manager
python api docker postgresql backend flask,Backend Developer
hr relations policies training employee,HR Manager
systems optimization c++ debugging programming memory pointers,Software Engineer
investigation media reporting,Journalist
network monitoring switching routing,Network Engineer
graphics animation motion,Animator
levels game design,Game Designer
java microservices springboot sql backend restapi,Backend Developer
management hotel operations,Hotel Manager
communication publicrelations marketing,Public Relations Manager
accounting taxation tally auditing finance,Banking Officer
caseanalysis legalresearch law,Lawyer
security crypto blockchain web3,Blockchain Developer
communication problem support,Customer Support Specialist
ec2 s3 aws cloud iam monitoring,Cloud Engineer
design planning interior,Interior Designer
engine game c++ development graphics,Game Developer
tourism management travel,Travel Consultant
advertising analytics googleads marketing,Digital Marketing Specialist
seo analytics keywords content,SEO Specialist
socialmedia strategy content marketing,Digital Marketing Specialist
development product planning marketresearch strategy,Product Manager
presentation negotiation communication targets sales,Marketing Manager
analytics etl datamodeling sql datawarehouse,Data Engineer
express react mongodb fullstack node mern,Full Stack Developer
api docker backend postgresql flask python,Backend Developer
teaching classroom education,Teacher
mobile development android apps kotlin,Mobile App Developer
training hr management recruitment hiring,HR Manager
backend jdbc collections oop multithreading java spring,Software Engineer
publicrelations branding media communication,Public Relations Manager
ai neuralnetworks python machinelearning modeling tensorflow,Machine Learning Engineer
strategy marketresearch planning product development,Product Manager
ai machinelearning python tensorflow deeplearning,AI Engineer
3d modeling animation,Animator
docker automation jenkins deployment cloud pipeline,DevOps Engineer
logistics procurement supplychain,Supply Chain Manager
analysis policy economicresearch,Economist
news journalism writing reporting,Journalist
editing video creativity,Video Editor
startup marketing businessdevelopment,Entrepreneur
unreal c++ 3d design game,Game Developer
seo socialmedia campaign marketing,Digital Marketing Specialist
3d animation modeling,Animator
data analysis research,Research Analyst
services banking compliance operations finance,Banking Officer
tourism travel planning,Travel Consultant
design prototype wireframe uiux figma,Graphic Designer
game graphics c++ development engine,Game Developer
innovation business strategy,Entrepreneur
neuralnetworks machinelearning tensorflow ai modeling python,Machine Learning Engineer
salesstrategy communication targets marketing,Sales Manager
analytics modeling r dataanalysis statistics visualization,Data Scientist
communication problem support,Customer Support Specialist
backend frontend development api database fullstack,Full Stack Developer
infrastructure linux monitoring scripting automation devops,DevOps Engineer
growth marketing seo analytics,Digital Marketing Specialist
recovery database postgresql backup,Database Administrator
javascript apps ui mobile reactnative,Mobile App Developer
design concept game,Game Designer
logistics planning management operations,Operations Manager
wan lan infrastructure network,Network Engineer
iam monitoring cloud ec2 s3 aws,Cloud Engineer
media communication publicrelations branding,Public Relations Manager
html backend flask css javascript sql,Full Stack Developer
event management coordination,Event Manager
coordination management event,Event Manager
authentication django backend python api sql,Backend Developer
videoediting editing premiere,Video Editor
legal argument court law,Lawyer
python pipeline etl dataengineering airflow,Data Engineer
service hospitality management,Hotel Manager
r visualization dataanalysis statistics modeling analytics,Data Scientist
creativity design animation,Animator
strategy market planning reporting analysis,Business Analyst
python datavisualization sql tableau reporting analytics,Data Scientist
dataengineering pipeline etl airflow python,Data Engineer
policies hr employee training relations,HR Manager
pandas dataanalysis machinelearning python numpy statistics,Data Scientist
operations logistics planning,Supply Chain Manager
3d animation modeling,Animator
marketing googleads analytics advertising,Digital Marketing Specialist
learning communication education,Teacher
data research analysis,Research Analyst
communication branding publicrelations,Public Relations Manager
news writing media,Journalist
psychology research counselling,Psychologist
modeling riskanalysis excel investment finance,Financial Analyst
docker backend flask postgresql api python,Backend Developer
cisco routing firewall network,Network Engineer
reporting news journalism writing,Journalist
economics research reporting,Economist
advertising marketing seo socialmedia content,Marketing Manager
frontend api javascript vue axios css,Frontend Developer
logistics supplychain procurement,Supply Chain Manager
branding digitalmarketing seo contentmarketing,Digital Marketing Specialist
uiux design wireframe interaction prototype,UI UX Designer
hotel management operations,Hotel Manager
visual photography editing,Photographer
event communication organization,Event Manager
animation game physics unity,Game Developer
design interior planning,Interior Designer
adobe creativity visual design editing,Graphic Designer
behavior counselling therapy psychology,Psychologist
banking financialanalysis portfolio investment finance,Financial Analyst
reporting communication journalism,Journalist
education classroom teaching,Teacher
planning booking tourism,Travel Consultant
analysis marketresearch report,Research Analyst
eventplanning coordination management,Event Manager
visualization sklearn analytics seaborn matplotlib python,Data Scientist
economics analysis research,Economist
gcp ci/cd cloud terraform automation devops,Cloud Engineer
businessdevelopment startup growth,Entrepreneur
sales leadgeneration closing deals negotiation,Sales Manager
analytics reporting strategy business planning,Business Analyst
dataanalysis research report,Research Analyst
contracts legalresearch litigation law,Lawyer
editing writing creation content blogging,Content Writer
financialanalysis risk banking investment portfolio,Banking Officer
news writing journalism reporting,Journalist
communication branding publicrelations,Public Relations Manager
apps android development mobile studio java,Mobile App Developer
web3 crypto security blockchain,Blockchain Developer
deeplearning ai machinelearning tensorflow python,AI Engineer
backlinks marketing optimization seo,SEO Specialist
sqlserver maintenance monitoring database,Database Administrator
strategy socialmedia marketing content,Digital Marketing Specialist
research economics analysis,Economist
debugging optimization memory programming systems c++ pointers,Software Engineer
devops kubernetes docker aws cloud linux terraform,Cloud Engineer
oop multithreading java collections backend spring jdbc,Software Engineer
customer planning travel,Travel Consultant
communication problem support,Customer Support Specialist
project communication leadership planning,Project Manager
python pandas ml analytics data preprocessing,Machine Learning Engineer
modeling ai python sklearn algorithms ml,Machine Learning Engineer
seo marketing content googleanalytics,SEO Specialist
development java studio apps mobile android,Mobile App Developer
uiux designthinking research usability figma,UI UX Designer
investment riskanalysis banking finance excel,Banking Officer
relations marketing customer strategy sales,Sales Manager
composition camera photography,Photographer
interior design planning,Interior Designer
analysis statistics research,Research Analyst
talent recruitment hr hiring acquisition,HR Manager
hr relations training policies employee,HR Manager
leadership management entrepreneurship,Entrepreneur
inventory supplychain management,Supply Chain Manager
web3 crypto security blockchain,Blockchain Developer
ethereum blockchain development solidity,Blockchain Developer
marketresearch report analysis,Research Analyst
modeling riskanalysis finance excel investment,Financial Analyst
camera photography editing,Photographer
planning analytics business reporting strategy,Business Analyst
process analysis documentation business modeling,Business Analyst
forecasting analysis economics,Economist
event planning logistics,Event Manager
contentstrategy editing writing seo blogging,Content Writer
solidity web3 smartcontracts ethereum,Blockchain Developer
devops ci/cd automation gcp cloud terraform,Cloud Engineer
customer service support,Customer Support Specialist
python hadoop pipeline spark dataengineering,Data Engineer
html sql flask css backend javascript,Full Stack Developer
physics animation unity game,Game Developer
strategy socialmedia content marketing,Digital Marketing Specialist
economicresearch policy analysis,Economist
branding contentmarketing digitalmarketing seo,Digital Marketing Specialist
design mechanics game,Game Designer
hospitality management service,Hotel Manager
javascript reactnative apps ui mobile,Mobile App Developer
marketing sales branding campaign analytics strategy,Marketing Manager
react frontend nodejs javascript fullstack sql,Full Stack Developer
report marketresearch analysis,Research Analyst
computervision ai deeplearning opencv,AI Engineer
classroom education teaching,Teacher
growth marketing seo analytics,Digital Marketing Specialist
mentalhealth therapy psychology,Psychologist
legal argument law court,Lawyer
distribution supplychain analysis,Supply Chain Manager
production editing video,Video Editor
financial valuation investment finance analysis,Financial Analyst
mysql api backend server php laravel,Backend Developer
sql etl analytics datamodeling datawarehouse,Data Engineer
product development strategy planning marketresearch,Product Manager
media branding communication publicrelations,Public Relations Manager
communication project leadership planning,Project Manager
optimization supplychain operations,Operations Manager
law contracts negotiation,Lawyer
monitoring iam cloud aws s3 ec2,Cloud Engineer
graphics c++ development game engine,Game Developer
apps development dart mobile flutter ui,Mobile App Developer
problem communication support,Customer Support Specialist
hotel operations management,Hotel Manager
analysis budgeting finance accounting financialreporting,Financial Analyst
game mechanics design,Game Designer
machinelearning python pandas dataanalysis numpy statistics,Data Scientist
security database oracle administration,Database Administrator
ui animation unity game c#,Game Developer
development apps apple mobile swift ios,Mobile App Developer
sklearn modeling ai python algorithms ml,Machine Learning Engineer
api mysql server php backend laravel,Backend Developer
communication documentation stakeholder requirements analysis,Business Analyst
aftereffects motion videoediting,Video Editor
planning travel tourism,Travel Consultant
therapy psychology counselling behavior,Psychologist
logistics planning operations,Supply Chain Manager
design uiux prototype figma wireframe,Graphic Designer
teaching education classroom,Teacher
seo traffic growth analytics,SEO Specialist
photography composition camera,Photographer
fullstack mongodb react express nodejs api,Full Stack Developer
python transformers nlp pytorch ai,AI Engineer
routing tcpip networking switching,Network Engineer
growth businessdevelopment startup,Entrepreneur
design uiux figma prototype wireframe,Graphic Designer
interior creativity design,Interior Designer
reporting media investigation,Journalist
socialmedia marketing seo advertising content,Marketing Manager
logistics procurement supplychain,Supply Chain Manager
blogging editing writing article storytelling,Content Writer
economics forecasting analysis,Economist
management tourism travel,Travel Consultant
statistics dataanalysis r modeling visualization analytics,Data Scientist
financialanalysis investment banking portfolio finance,Financial Analyst
vulnerability firewall security incidentresponse testing,Cybersecurity Analyst
gamedesign concept creativity,Game Designer
branding campaign analytics strategy sales marketing,Marketing Manager
python transformers ai nlp pytorch,AI Engineer
modeling 3d animation,Animator
googleads marketing advertising analytics,Digital Marketing Specialist
marketing advertising seo socialmedia content,Marketing Manager
modeltraining python neuralnetworks ai tensorflow,AI Engineer
riskmanagement projectplanning teammanagement,Project Manager
userexperience figma prototype uiux design,UI UX Designer
law legalresearch contracts litigation,Lawyer
research report dataanalysis,Research Analyst
travel communication tourism,Travel Consultant
networking switching routing tcpip,Network Engineer
strategy development marketresearch planning product,Product Manager
database recovery backup postgresql,Database Administrator
legalresearch litigation law contracts,Lawyer
analytics python ml data preprocessing pandas,Machine Learning Engineer
education training teaching,Teacher
communication media reputation,Public Relations Manager
backlinks marketing seo optimization,SEO Specialist
development game c++ engine graphics,Game Developer
riskanalysis investment excel finance modeling,Financial Analyst
modeldeployment deeplearning pytorch ai,AI Engineer
research economics analysis,Economist
creativity design interior,Interior Designer
analysis operations logistics planning,Operations Manager
strategy productlifecycle roadmap planning,Product Manager
planning logistics event,Event Manager
economics analysis forecasting,Economist
data processing hadoop spark etl bigdata,Data Engineer
