skills,career
communication customerservice,Customer Support Specialist
writing editing blogging content creation,Content Writer
hospitality customer management,Hotel Manager
strategy market planning reporting analysis,Business Analyst
threatanalysis forensics siem malware networksecurity,Cybersecurity Analyst
decor design spaceplanning,Interior Designer
communication branding media publicrelations,Public Relations Manager
analytics statistics dataanalysis r visualization modeling,Data Scientist
network vpn protocols networksecurity,Network Engineer
court legal argument law,Lawyer
branding campaign strategy marketing analytics sales,Marketing Manager
communication branding publicrelations media,Public Relations Manager
communication media pressrelease branding,Public Relations Manager
express api fullstack react nodejs mongodb,Full Stack Developer
organization communication event,Event Manager
nlp ai pytorch python transformers,AI Engineer
linux debugging docker versioncontrol systems git,Software Engineer
law litigation legalwriting,Lawyer
photography creativity editing,Photographer
decor spaceplanning design,Interior Designer
presentation communication sales negotiation targets,Marketing Manager
investment finance analysis financial valuation,Financial Analyst
finance analysis portfolio investment management,Financial Analyst
caseanalysis legalresearch law,Lawyer
modeling statistics dataanalysis r visualization analytics,Data Scientist
curriculum education teaching planning,Teacher
ec2 cloud aws s3 monitoring iam,Cloud Engineer
management operations hotel,Hotel Manager
ai algorithms python modeling ml sklearn,Machine Learning Engineer
design creativity animation,Animator
html css frontend typescript uiux angular,Frontend Developer
editing writing blogging storytelling article,Content Writer
psychology therapy counselling behavior,Psychologist
prototype wireframe figma design uiux,Graphic Designer
python ai nlp pytorch transformers,AI Engineer
prototype uiux design figma userexperience,UI UX Designer
planning logistics operations,Supply Chain Manager
engagement training employee hr management,HR Manager
development mobile apps kotlin android,Mobile App Developer
productplanning strategy analytics management roadmap,Product Manager
seo keywords content analytics,SEO Specialist
network lan wan infrastructure,Network Engineer
restapi sql backend microservices springboot java,Backend Developer
dataengineering hadoop pipeline python spark,Data Engineer
education classroom teaching,Teacher
strategy branding growth planning marketresearch,Marketing Manager
report marketresearch analysis,Research Analyst
crypto web3 security blockchain,Blockchain Developer
marketing copywriting blogging writing content,Content Writer
closing negotiation deals leadgeneration sales,Sales Manager
optimization supplychain operations,Operations Manager
finance investment management portfolio analysis,Financial Analyst
photography camera composition,Photographer
contentstrategy editing writing seo blogging,Content Writer
visual design animation,Animator
animation storyboard design,Animator
editing video storytelling,Video Editor
analysis supplychain distribution,Supply Chain Manager
closing sales deals negotiation leadgeneration,Sales Manager
productlifecycle strategy planning roadmap,Product Manager
incidentresponse testing firewall vulnerability security,Cybersecurity Analyst
creativity design animation,Animator
layout typography creativity poster canva,Graphic Designer
editing video production,Video Editor
advertising socialmedia marketing seo content,Marketing Manager
planning customer travel,Travel Consultant
postgresql database recovery backup,Database Administrator
ethereum web3 solidity smartcontracts,Blockchain Developer
concept creativity gamedesign,Game Designer
logistics operations planning,Supply Chain Manager
roadmap strategy analytics management productplanning,Product Manager
innovation strategy business,Entrepreneur
web3 smartcontracts ethereum solidity,Blockchain Developer
eventmanagement planning budget,Event Manager
forensics networksecurity threatanalysis malware siem,Cybersecurity Analyst
media reporting investigation,Journalist
planning teaching curriculum education,Teacher
travel communication tourism,Travel Consultant
strategy business innovation,Entrepreneur
law legal court argument,Lawyer
planning project communication leadership,Project Manager
c++ development game graphics engine,Game Developer
planning logistics supplychain,Supply Chain Manager
docker git systems debugging versioncontrol linux,Software Engineer
optimization seo searchengine ranking,SEO Specialist
organization communication event,Event Manager
communication requirements stakeholder documentation analysis,Business Analyst
oracle database security administration,Database Administrator
mongodb nodejs api backend server express,Backend Developer
branding design illustrator photoshop creativity,Graphic Designer
optimization operations supplychain,Operations Manager
creativity editing video,Video Editor
reporting research economics,Economist
support problem communication,Customer Support Specialist
sklearn ai algorithms modeling python ml,Machine Learning Engineer
scrum projectmanagement agile,Project Manager
presentation targets communication sales negotiation,Sales Manager
mobile development apps ios swift apple,Mobile App Developer
creativity concept gamedesign,Game Designer
python datawarehouse hadoop etl sql spark,Data Engineer
innovation strategy business,Entrepreneur
cloud terraform gcp automation devops ci/cd,Cloud Engineer
database performance sql optimization mysql,Database Administrator
design animation visual,Animator
deeplearning python neuralnetworks keras ai tensorflow,Data Scientist
api python flask docker postgresql backend,Backend Developer
kubernetes cloud container devops docker automation,DevOps Engineer
creativity editing photography,Photographer
automation kubernetes ci/cd devops docker pipeline,DevOps Engineer
sql backend flask html css javascript,Full Stack Developer
routing cisco network firewall,Network Engineer
firewall cisco network routing,Network Engineer
api python flask docker postgresql backend,Backend Developer
vpn network protocols networksecurity,Network Engineer
banking loan credit compliance finance,Banking Officer
productlifecycle strategy roadmap planning,Product Manager
nlp ai pytorch python transformers,AI Engineer
marketresearch planning branding strategy growth,Marketing Manager
communication education learning,Teacher
animation game unity c# ui,Game Developer
planning leadership communication project,Project Manager
design storyboard animation,Animator
blockchain smartcontracts ethereum solidity,Blockchain Developer
video production editing,Video Editor
tourism communication travel,Travel Consultant
express api backend mongodb nodejs server,Backend Developer
backend microservices java springboot restapi sql,Backend Developer
banking investment portfolio financialanalysis finance,Financial Analyst
psychology research counselling,Psychologist
decor spaceplanning design,Interior Designer
media branding publicrelations communication,Public Relations Manager
tourism planning travel,Travel Consultant
stakeholder planning scrum management,Project Manager
supplychain procurement logistics,Supply Chain Manager
video production editing,Video Editor
marketing socialmedia strategy content,Digital Marketing Specialist
prototype figma design userresearch uiux,UI UX Designer
psychology therapy mentalhealth,Psychologist
backend html javascript sql css flask,Full Stack Developer
development marketresearch strategy product planning,Product Manager
presentation negotiation targets sales communication,Sales Manager
reporting excel business dataanalysis analytics,Business Analyst
keras tensorflow deeplearning neuralnetworks ai python,Data Scientist
airflow pipeline dataengineering etl python,Data Engineer
hospitality service management,Hotel Manager
counselling psychology behavior therapy,Psychologist
reporting research economics,Economist
backlinks marketing seo optimization,SEO Specialist
ci/cd automation terraform cloud gcp devops,Cloud Engineer
economics research analysis,Economist
videoediting editing premiere,Video Editor
creativity concept gamedesign,Game Designer
development game c++ graphics engine,Game Developer
editing video creativity,Video Editor
management leadership entrepreneurship,Entrepreneur
marketing customer sales strategy relations,Sales Manager
presentation education communication teaching,Teacher
cloud terraform automation devops gcp ci/cd,Cloud Engineer
operations hotel management,Hotel Manager
service hospitality management,Hotel Manager
interior design architecture,Interior Designer
editing photography creativity,Photographer
nodejs mongodb fullstack react express api,Full Stack Developer
hiring talent hr acquisition recruitment,HR Manager
psychology behavior therapy counselling,Psychologist
concept design game,Game Designer
reporting economics research,Economist
content creation blogging writing editing,Content Writer
linux cloud aws devops terraform kubernetes docker,Cloud Engineer
mobile dart flutter ui development apps,Mobile App Developer
management operations strategy,Operations Manager
tourism communication travel,Travel Consultant
seo campaign socialmedia marketing,Digital Marketing Specialist
api backend django authentication sql python,Backend Developer
design animation storyboard,Animator
dart flutter mobile apps ui development,Mobile App Developer
leadership planning projectmanagement agile,Project Manager
data hadoop etl processing bigdata spark,Data Engineer
concept game design,Game Designer
unity development graphics c# game,Game Developer
devops networking deployment cloud linux azure,Cloud Engineer
composition camera photography,Photographer
strategy marketing content socialmedia,Digital Marketing Specialist
design animation creativity,Animator
design prototype interaction uiux wireframe,UI UX Designer
aws iam ec2 monitoring s3 cloud,Cloud Engineer
operations management hotel,Hotel Manager
research reporting economics,Economist
support communication problem,Customer Support Specialist
mentalhealth psychology therapy,Psychologist
writing editing creation content blogging,Content Writer
gamedesign concept creativity,Game Designer
agile projectmanagement scrum,Project Manager
userexperience design figma uiux prototype,UI UX Designer
marketing backlinks seo optimization,SEO Specialist
neuralnetworks deep pytorch training learning ai,Machine Learning Engineer
uiux angular css frontend typescript html,Frontend Developer
photography editing creativity,Photographer
photography camera editing,Photographer
3d animation modeling,Animator
logistics planning event,Event Manager
customerservice communication support,Customer Support Specialist
riskanalysis investment excel finance banking,Banking Officer
indexing database optimization query,Database Administrator
travel management tourism,Travel Consultant
jdbc multithreading collections java backend oop spring,Software Engineer
strategy growth marketresearch planning branding,Marketing Manager
management planning logistics operations,Operations Manager
ios apps swift development apple mobile,Mobile App Developer
communication service support,Customer Support Specialist
support communication customerservice,Customer Support Specialist
design game levels,Game Designer
communication branding pressrelease media,Public Relations Manager
operations management planning logistics,Operations Manager
deeplearning machinelearning tensorflow python ai,AI Engineer
planning logistics event,Event Manager
apple ios mobile development swift apps,Mobile App Developer
hr acquisition talent recruitment hiring,HR Manager
solidity blockchain web3 crypto defi,Blockchain Developer
nlp ai python transformers pytorch,AI Engineer
analytics marketing advertising googleads,Digital Marketing Specialist
multithreading jdbc collections oop backend spring java,Software Engineer
customer hospitality management,Hotel Manager
firewall routing network cisco,Network Engineer
planning strategy productlifecycle roadmap,Product Manager
management customer hospitality,Hotel Manager
modeltraining ml ai tensorflow python,Machine Learning Engineer
supplychain logistics planning,Supply Chain Manager
innovation business strategy,Entrepreneur
node mern express fullstack react mongodb,Full Stack Developer
documentation communication analysis requirements stakeholder,Business Analyst
userexperience design prototype figma uiux,UI UX Designer
planning operations logistics,Supply Chain Manager
pytorch ai training deep neuralnetworks learning,Machine Learning Engineer
report analysis marketresearch,Research Analyst
seo editing writing blogging contentstrategy,Content Writer
editing design creativity visual adobe,Graphic Designer
design creativity interior,Interior Designer
ui apps flutter dart development mobile,Mobile App Developer
analysis research data,Research Analyst
optimization database query indexing,Database Administrator
legalresearch litigation contracts law,Lawyer
mechanics story gamedesign,Game Designer
versioncontrol git debugging docker systems linux,Software Engineer
marketresearch development product planning strategy,Product Manager
law negotiation contracts,Lawyer
wan network lan infrastructure,Network Engineer
video creativity editing,Video Editor
creativity photoshop illustrator design branding,Graphic Designer
c# unity game graphics development,Game Developer
studio android development java apps mobile,Mobile App Developer
photography composition camera,Photographer
visual animation design,Animator
training ai pytorch learning deep neuralnetworks,Machine Learning Engineer
ai python ml sklearn algorithms modeling,Machine Learning Engineer
analysis research data,Research Analyst
data python pandas analytics ml preprocessing,Machine Learning Engineer
aftereffects videoediting motion,Video Editor
therapy psychology mentalhealth,Psychologist
litigation law contracts legalresearch,Lawyer
event coordination management,Event Manager
analysis valuation finance financial investment,Financial Analyst
education training teaching,Teacher
taxation finance accounting auditing tally,Banking Officer
api django backend python authentication sql,Backend Developer
traffic growth analytics seo,SEO Specialist
marketing startup businessdevelopment,Entrepreneur
banking portfolio financialanalysis investment risk,Banking Officer
logistics procurement supplychain,Supply Chain Manager
planning hospitality service,Hotel Manager
poster layout creativity typography canva,Graphic Designer
network vpn protocols networksecurity,Network Engineer
training deep neuralnetworks ai learning pytorch,Machine Learning Engineer
analysis supplychain distribution,Supply Chain Manager
operations planning logistics analysis,Operations Manager
planning communication leadership project,Project Manager
graphics game c++ development engine,Game Developer
inventory management supplychain,Supply Chain Manager
editing camera photography,Photographer
infrastructure devops linux automation scripting monitoring,DevOps Engineer
uiux userexperience prototype figma design,UI UX Designer
leadership planning communication project,Project Manager
smartcontracts blockchain solidity ethereum,Blockchain Developer
distribution supplychain analysis,Supply Chain Manager
animation creativity design,Animator
strategy marketing content socialmedia,Digital Marketing Specialist
economicresearch analysis policy,Economist
growth startup businessdevelopment,Entrepreneur
marketing seo content googleanalytics,SEO Specialist
planning customer travel,Travel Consultant
survey analysis research,Research Analyst
credit loan compliance banking finance,Banking Officer
ai neuralnetworks modeling python tensorflow machinelearning,Machine Learning Engineer
business strategy innovation,Entrepreneur
writing blogging creation editing content,Content Writer
branding communication media publicrelations,Public Relations Manager
litigation law legalresearch contracts,Lawyer
roadmap strategy product agile stakeholder,Product Manager
news writing journalism reporting,Journalist
ethicalhacking security networking firewall linux cybersecurity,Cybersecurity Analyst
operations management process,Operations Manager
reporting strategy analysis planning market,Business Analyst
planning tourism booking,Travel Consultant
education learning communication,Teacher
ethereum solidity blockchain development,Blockchain Developer
branding contentmarketing seo digitalmarketing,Digital Marketing Specialist
communication journalism reporting,Journalist
visual creativity editing design adobe,Graphic Designer
container docker cloud kubernetes devops automation,DevOps Engineer
userresearch figma design prototype uiux,UI UX Designer
design sass frontend ui react responsive,Frontend Developer
unity development c# graphics game,Game Developer
support customer service,Customer Support Specialist
pipeline docker devops kubernetes ci/cd automation,DevOps Engineer
security ethicalhacking networking cybersecurity linux firewall,Cybersecurity Analyst
negotiation closing leadgeneration deals sales,Sales Manager
flask docker python postgresql backend api,Backend Developer
media branding publicrelations communication,Public Relations Manager
videoediting motion aftereffects,Video Editor
concept gamedesign creativity,Game Designer
travel communication tourism,Travel Consultant
logistics planning analysis operations,Operations Manager
hr performance management training recruitment,HR Manager
cloud container kubernetes automation docker devops,DevOps Engineer
deeplearning ai modeldeployment pytorch,AI Engineer
jdbc spring oop java multithreading collections backend,Software Engineer
management logistics planning operations,Operations Manager
creativity illustrator design photoshop branding,Graphic Designer
visual editing photography,Photographer
automation docker kubernetes ci/cd pipeline devops,DevOps Engineer
excel finance investment riskanalysis modeling,Financial Analyst
service hospitality management,Hotel Manager
negotiation law contracts,Lawyer
socialmedia marketing content strategy,Digital Marketing Specialist
survey research analysis,Research Analyst
performance optimization sql database mysql,Database Administrator
protocols vpn network networksecurity,Network Engineer
investigation media reporting,Journalist
animation 3d modeling,Animator
planning booking tourism,Travel Consultant
ci/cd devops cloud automation gcp terraform,Cloud Engineer
analysis management investment finance portfolio,Financial Analyst
branding pressrelease media communication,Public Relations Manager
management roadmap productplanning analytics strategy,Product Manager
strategy relations sales customer marketing,Sales Manager
planning business analytics reporting strategy,Business Analyst
relations employee training policies hr,HR Manager
responsive design sass ui react frontend,Frontend Developer
network cisco firewall routing,Network Engineer
education communication teaching presentation,Teacher
strategy roadmap analytics productplanning management,Product Manager
airflow python etl dataengineering pipeline,Data Engineer
communication salesstrategy marketing targets,Sales Manager
photography creativity editing,Photographer
unity game c# ui animation,Game Developer
googleads marketing analytics advertising,Digital Marketing Specialist
docker backend postgresql api flask python,Backend Developer
seo socialmedia advertising content marketing,Marketing Manager
figma design prototype uiux userexperience,UI UX Designer
psychology research counselling,Psychologist
hr hiring recruitment management training,HR Manager
socialmedia seo content marketing advertising,Marketing Manager
communication service support,Customer Support Specialist
customer management hospitality,Hotel Manager
game engine graphics c++ development,Game Developer
reporting analytics tableau sql datavisualization python,Data Scientist
stakeholder scrum management planning,Project Manager
dart apps ui flutter mobile development,Mobile App Developer
modeltraining python tensorflow neuralnetworks ai,AI Engineer
html typescript css angular uiux frontend,Frontend Developer
compliance banking operations services finance,Banking Officer
photoshop branding design creativity illustrator,Graphic Designer
communication support service,Customer Support Specialist
counselling research psychology,Psychologist
contracts law negotiation,Lawyer
market planning strategy analysis reporting,Business Analyst
management inventory supplychain,Supply Chain Manager
recruitment hr hiring management training,HR Manager
motion aftereffects videoediting,Video Editor
operations management strategy,Operations Manager
decor design spaceplanning,Interior Designer
recruitment hr management training performance,HR Manager
editing article storytelling writing blogging,Content Writer
stakeholder scrum management planning,Project Manager
modeltraining ai python tensorflow neuralnetworks,AI Engineer
tourism planning travel,Travel Consultant
creativity photography editing,Photographer
authentication django python api backend sql,Backend Developer
strategy growth planning marketresearch branding,Marketing Manager
photography editing visual,Photographer
security web3 crypto blockchain,Blockchain Developer
solidity web3 ethereum smartcontracts,Blockchain Developer
finance compliance banking operations services,Banking Officer
investment riskanalysis finance excel modeling,Financial Analyst
branding communication publicrelations,Public Relations Manager
development graphics game engine c++,Game Developer
video creativity editing,Video Editor
production editing video,Video Editor
animation graphics motion,Animator
legalresearch law caseanalysis,Lawyer
pandas analytics data preprocessing ml python,Machine Learning Engineer
projectplanning riskmanagement teammanagement,Project Manager
python modeltraining tensorflow ai neuralnetworks,AI Engineer
visual animation design,Animator
economics analysis forecasting,Economist
excel finance investment modeling riskanalysis,Financial Analyst
backend authentication api python django sql,Backend Developer
figma design prototype userexperience uiux,UI UX Designer
react responsive uiux javascript css html,Frontend Developer
research economics analysis,Economist
talent acquisition hr hiring recruitment,HR Manager
roadmap strategy productlifecycle planning,Product Manager
blogging editing storytelling article writing,Content Writer
photoshoot lighting camera,Photographer
photography creativity editing,Photographer
layout typography creativity poster canva,Graphic Designer
digitalmarketing branding analytics campaign strategy,Marketing Manager
jdbc backend collections java spring multithreading oop,Software Engineer
linux kali security cyberlaw ethicalhacking,Cybersecurity Analyst
entrepreneurship leadership management,Entrepreneur
operations management strategy,Operations Manager
scripting monitoring devops infrastructure linux automation,DevOps Engineer
salesstrategy marketing targets communication,Sales Manager
customerservice communication,Customer Support Specialist
css typescript frontend html uiux angular,Frontend Developer
php api laravel backend server mysql,Backend Developer
logistics planning operations,Supply Chain Manager
videoediting motion aftereffects,Video Editor
web3 ethereum smartcontracts solidity,Blockchain Developer
searchengine ranking optimization seo,SEO Specialist
collections oop backend multithreading spring jdbc java,Software Engineer
research analysis statistics,Research Analyst
startup businessdevelopment marketing,Entrepreneur
keywords analytics content seo,SEO Specialist
hotel operations management,Hotel Manager
coordination event management,Event Manager
responsive frontend sass ui react design,Frontend Developer
apps ios development swift apple mobile,Mobile App Developer
innovation startup business strategy,Entrepreneur
growth startup businessdevelopment,Entrepreneur
database performance sql mysql optimization,Database Administrator
tableau analytics sql datavisualization python reporting,Data Scientist
graphics game engine c++ development,Game Developer
socialmedia strategy content marketing,Digital Marketing Specialist
responsive ui sass design frontend react,Frontend Developer
springboot microservices java restapi sql backend,Backend Developer
unreal design 3d c++ game,Game Developer
psychology therapy counselling behavior,Psychologist
publicrelations communication branding,Public Relations Manager
businessdevelopment strategy sales negotiation,Sales Manager
media writing news,Journalist
devops cloud linux aws terraform docker kubernetes,Cloud Engineer
news media writing,Journalist
ui unity game c# animation,Game Developer
unity c# game animation ui,Game Developer
operations analysis logistics planning,Operations Manager
tally auditing finance taxation accounting,Banking Officer
android apps development kotlin mobile,Mobile App Developer
threatanalysis malware networksecurity forensics siem,Cybersecurity Analyst
database security administration oracle,Database Administrator
planning analysis market strategy reporting,Business Analyst
planning travel customer,Travel Consultant
tourism planning booking,Travel Consultant
design game levels,Game Designer
management supplychain inventory,Supply Chain Manager
analysis supplychain distribution,Supply Chain Manager
spaceplanning design decor,Interior Designer
motion animation graphics,Animator
nlp python ai transformers pytorch,AI Engineer
research analysis data,Research Analyst
linux debugging docker git systems versioncontrol,Software Engineer
law legalresearch caseanalysis,Lawyer
excel finance investment riskanalysis banking,Banking Officer
cybersecurity networking linux firewall security ethicalhacking,Cybersecurity Analyst
