skills,career
analysis reporting news,Journalist
hospitality service planning,Hotel Manager
devops deployment azure cloud linux networking,Cloud Engineer
pipeline devops cloud automation docker jenkins,Cloud Engineer
travel tourism communication,Travel Consultant
support service customer,Customer Support Specialist
api mongodb server express nodejs backend,Backend Developer
sklearn python seaborn matplotlib visualization analytics,Data Scientist
economicresearch policy analysis,Economist
economics reporting research,Economist
interior design creativity,Interior Designer
game animation unity physics,Game Developer
blockchain security web3 crypto,Blockchain Developer
creativity visual design adobe editing,Graphic Designer
jdbc multithreading java backend spring collections oop,Software Engineer
negotiation sales deals leadgeneration closing,Sales Manager
python hadoop etl spark datawarehouse sql,Data Engineer
forecasting economics analysis,Economist
mobile apps android development java studio,Mobile App Developer
analytics growth seo marketing,Digital Marketing Specialist
express node mongodb fullstack react mern,Full Stack Developer
mentalhealth therapy psychology,Psychologist
law contracts legalresearch litigation,Lawyer
learning communication education,Teacher
targets communication sales presentation negotiation,Marketing Manager
reporting media investigation,Journalist
writing blogging storytelling editing creativity,Content Writer
devops cloud linux aws docker kubernetes terraform,Cloud Engineer
networking switching routing tcpip,Network Engineer
requirements analysis stakeholder communication documentation,Business Analyst
backlinks marketing optimization seo,SEO Specialist
design game concept,Game Designer
marketing seo optimization backlinks,SEO Specialist
maintenance database monitoring sqlserver,Database Administrator
editing visual photography,Photographer
writing creativity storytelling editing blogging,Content Writer
marketing salesstrategy targets communication,Sales Manager
operations management logistics planning,Operations Manager
management travel tourism,Travel Consultant
deeplearning computervision ai opencv,AI Engineer
incidentresponse security firewall vulnerability testing,Cybersecurity Analyst
indexing database query optimization,Database Administrator
businessdevelopment marketing startup,Entrepreneur
design game mechanics,Game Designer
ethicalhacking firewall security cybersecurity networking linux,Cybersecurity Analyst
ai tensorflow modeltraining python neuralnetworks,AI Engineer
reporting investigation media,Journalist
modeltraining ml tensorflow python ai,Machine Learning Engineer
unity ui animation c# game,Game Developer
security crypto web3 blockchain,Blockchain Developer
analytics growth marketing seo,Digital Marketing Specialist
networksecurity siem forensics malware threatanalysis,Cybersecurity Analyst
photoshop creativity illustrator branding design,Graphic Designer
mentalhealth psychology therapy,Psychologist
writing media news,Journalist
programming memory debugging c++ systems optimization pointers,Software Engineer
analysis survey research,Research Analyst
docker flask postgresql api python backend,Backend Developer
vpn network networksecurity protocols,Network Engineer
budget planning eventmanagement,Event Manager
monitoring s3 cloud ec2 iam aws,Cloud Engineer
video production editing,Video Editor
teaching education classroom,Teacher
wireframe figma prototype design uiux,UI UX Designer
news analysis reporting,Journalist
photoshoot lighting camera,Photographer
therapy psychology mentalhealth,Psychologist
booking tourism planning,Travel Consultant
copywriting blogging content writing marketing,Content Writer
communication support customerservice,Customer Support Specialist
teaching classroom education,Teacher
neuralnetworks pytorch ai deep learning training,Machine Learning Engineer
postgresql flask python backend docker api,Backend Developer
analysis research statistics,Research Analyst
oop algorithms dsa python datastructures debugging programming,Software Engineer
campaign marketing analytics sales strategy branding,Marketing Manager
memory optimization programming pointers systems c++ debugging,Software Engineer
finance analysis management investment portfolio,Financial Analyst
management coordination event,Event Manager
css react uiux javascript responsive html,Frontend Developer
nodejs frontend fullstack sql react javascript,Full Stack Developer
communication targets presentation sales negotiation,Marketing Manager
hospitality customer management,Hotel Manager
startup marketing businessdevelopment,Entrepreneur
management operations hotel,Hotel Manager
planning product marketresearch development strategy,Product Manager
law litigation legalwriting,Lawyer
content blogging editing creation writing,Content Writer
ui c# game animation unity,Game Developer
research statistics analysis,Research Analyst
design adobe creativity visual editing,Graphic Designer
linux penetrationtesting monitoring analysis security,Cybersecurity Analyst
sql flask backend css html javascript,Full Stack Developer
angular uiux html frontend css typescript,Frontend Developer
visualization python analytics seaborn sklearn matplotlib,Data Scientist
design wireframe uiux prototype figma,UI UX Designer
android kotlin apps mobile development,Mobile App Developer
documentation stakeholder analysis communication requirements,Business Analyst
pipeline dataengineering python hadoop spark,Data Engineer
editing photography camera,Photographer
media publicrelations communication branding,Public Relations Manager
statistics pandas python machinelearning numpy dataanalysis,Data Scientist
sales strategy relations customer marketing,Sales Manager
documentation business modeling analysis process,Business Analyst
datamodeling sql datawarehouse analytics etl,Data Engineer
deep ai neuralnetworks learning training pytorch,Machine Learning Engineer
modeltraining neuralnetworks python tensorflow ai,AI Engineer
algorithms ml modeling ai python sklearn,Machine Learning Engineer
investment excel riskanalysis finance modeling,Financial Analyst
swift development apple ios apps mobile,Mobile App Developer
creativity interior design,Interior Designer
planning education teaching curriculum,Teacher
devops container cloud docker kubernetes automation,DevOps Engineer
html backend sql javascript flask css,Full Stack Developer
media reputation communication,Public Relations Manager
penetrationtesting security linux analysis monitoring,Cybersecurity Analyst
switching routing networking tcpip,Network Engineer
leadgeneration deals sales closing negotiation,Sales Manager
layout furniture design,Interior Designer
digitalmarketing campaign analytics branding strategy,Marketing Manager
communication presentation teaching education,Teacher
python dataengineering pipeline spark hadoop,Data Engineer
event management coordination,Event Manager
visual design animation,Animator
database api fullstack frontend backend development,Full Stack Developer
auditing taxation accounting finance tally,Banking Officer
frontend css html uiux angular typescript,Frontend Developer
engine c++ development game graphics,Game Developer
marketing growth analytics seo,Digital Marketing Specialist
aftereffects videoediting motion,Video Editor
springboot backend java sql restapi microservices,Backend Developer
routing monitoring switching network,Network Engineer
tensorflow neuralnetworks modeltraining ai python,AI Engineer
travel customer planning,Travel Consultant
uiux design userresearch prototype figma,UI UX Designer
planning design interior,Interior Designer
editing photography camera,Photographer
analytics sql datamodeling datawarehouse etl,Data Engineer
camera editing photography,Photographer
planning scrum product agile roadmap,Product Manager
psychology therapy mentalhealth,Psychologist
content keywords analytics seo,SEO Specialist
agile strategy roadmap stakeholder product,Product Manager
education presentation communication teaching,Teacher
analysis psychology behavior,Psychologist
banking compliance operations finance services,Banking Officer
finance budgeting analysis accounting financialreporting,Financial Analyst
pipeline python airflow etl dataengineering,Data Engineer
finance services banking compliance operations,Banking Officer
riskmanagement teammanagement projectplanning,Project Manager
reporting analytics planning strategy business,Business Analyst
planning hospitality service,Hotel Manager
marketing startup businessdevelopment,Entrepreneur
analytics growth seo marketing,Digital Marketing Specialist
postgresql recovery backup database,Database Administrator
hr recruitment acquisition hiring talent,HR Manager
preprocessing data python analytics ml pandas,Machine Learning Engineer
database indexing optimization query,Database Administrator
reporting analytics business excel dataanalysis,Business Analyst
analysis statistics research,Research Analyst
hospitality planning service,Hotel Manager
c++ 3d unreal game design,Game Developer
vpn protocols networksecurity network,Network Engineer
stakeholder agile product roadmap strategy,Product Manager
process management operations,Operations Manager
api development backend frontend fullstack database,Full Stack Developer
education teaching training,Teacher
engagement management employee hr training,HR Manager
protocols networksecurity vpn network,Network Engineer
creativity animation design,Animator
seo traffic growth analytics,SEO Specialist
web3 defi blockchain solidity crypto,Blockchain Developer
growth analytics marketing seo,Digital Marketing Specialist
ml ai tensorflow python modeltraining,Machine Learning Engineer
sklearn modeling python ml ai algorithms,Machine Learning Engineer
composition camera photography,Photographer
requirements documentation stakeholder communication analysis,Business Analyst
research usability uiux designthinking figma,UI UX Designer
financial analysis finance valuation investment,Financial Analyst
creativity animation design,Animator
riskanalysis modeling finance investment excel,Financial Analyst
data research analysis,Research Analyst
pipeline spark dataengineering hadoop python,Data Engineer
services banking operations compliance finance,Banking Officer
management operations hotel,Hotel Manager
argument court legal law,Lawyer
firewall routing cisco network,Network Engineer
pressrelease media branding communication,Public Relations Manager
designthinking uiux research figma usability,UI UX Designer
budgeting analysis accounting finance financialreporting,Financial Analyst
monitoring scripting infrastructure automation linux devops,DevOps Engineer
business strategy innovation,Entrepreneur
analysis data research,Research Analyst
support communication problem,Customer Support Specialist
investigation media reporting,Journalist
mongodb react express fullstack node mern,Full Stack Developer
leadership management entrepreneurship,Entrepreneur
survey research analysis,Research Analyst
management hr training hiring recruitment,HR Manager
react ui design responsive sass frontend,Frontend Developer
creativity concept gamedesign,Game Designer
ai modeltraining ml python tensorflow,Machine Learning Engineer
bootstrap design figma css javascript html,Frontend Developer
python dataanalysis statistics pandas machinelearning numpy,Data Scientist
tensorflow machinelearning ai deeplearning python,AI Engineer
deeplearning python keras ai neuralnetworks tensorflow,Data Scientist
communication project leadership planning,Project Manager
spark dataengineering hadoop pipeline python,Data Engineer
design mechanics game,Game Designer
ethereum development solidity blockchain,Blockchain Developer
supplychain optimization operations,Operations Manager
documentation stakeholder requirements communication analysis,Business Analyst
legalresearch caseanalysis law,Lawyer
analytics reporting strategy planning business,Business Analyst
django api authentication python backend sql,Backend Developer
logistics supplychain planning,Supply Chain Manager
psychology behavior analysis,Psychologist
preprocessing ml data analytics python pandas,Machine Learning Engineer
siem malware networksecurity threatanalysis forensics,Cybersecurity Analyst
project communication leadership planning,Project Manager
siem malware forensics networksecurity threatanalysis,Cybersecurity Analyst
publicrelations marketing communication,Public Relations Manager
illustrator creativity photoshop branding design,Graphic Designer
operations hotel management,Hotel Manager
projectmanagement planning leadership agile,Project Manager
pandas analytics preprocessing data ml python,Machine Learning Engineer
law contracts negotiation,Lawyer
ml data preprocessing python pandas analytics,Machine Learning Engineer
management roadmap analytics strategy productplanning,Product Manager
debugging c++ systems memory optimization pointers programming,Software Engineer
therapy mentalhealth psychology,Psychologist
interaction wireframe uiux prototype design,UI UX Designer
mobile kotlin development android apps,Mobile App Developer
agile scrum roadmap planning product,Product Manager
html css sql javascript backend flask,Full Stack Developer
layout furniture design,Interior Designer
customer service support,Customer Support Specialist
spark etl sql hadoop python datawarehouse,Data Engineer
analytics reporting python tableau datavisualization sql,Data Scientist
statistics analysis research,Research Analyst
visual creativity editing adobe design,Graphic Designer
frontend api database fullstack backend development,Full Stack Developer
travel management tourism,Travel Consultant
growth marketresearch branding strategy planning,Marketing Manager
editing writing content creation blogging,Content Writer
teaching classroom education,Teacher
python nlp pytorch transformers ai,AI Engineer
interior planning design,Interior Designer
r statistics modeling analytics visualization dataanalysis,Data Scientist
deep learning neuralnetworks training ai pytorch,Machine Learning Engineer
learning education communication,Teacher
law negotiation contracts,Lawyer
web3 security blockchain crypto,Blockchain Developer
psychology analysis behavior,Psychologist
scrum agile projectmanagement,Project Manager
learning pytorch ai training neuralnetworks deep,Machine Learning Engineer
pytorch nlp ai transformers python,AI Engineer
writing blogging content copywriting marketing,Content Writer
growth seo traffic analytics,SEO Specialist
memory programming pointers systems debugging optimization c++,Software Engineer
backlinks marketing optimization seo,SEO Specialist
motion videoediting aftereffects,Video Editor
frontend axios css javascript vue api,Frontend Developer
neuralnetworks training learning deep pytorch ai,Machine Learning Engineer
planning service hospitality,Hotel Manager
ethicalhacking networking linux cybersecurity security firewall,Cybersecurity Analyst
devops docker jenkins cloud automation pipeline,Cloud Engineer
devops scripting automation infrastructure monitoring linux,DevOps Engineer
aws terraform docker devops cloud kubernetes linux,Cloud Engineer
creativity editing adobe design visual,Graphic Designer
python deeplearning tensorflow machinelearning ai,AI Engineer
game development c# graphics unity,Game Developer
creativity design interior,Interior Designer
kubernetes docker ci/cd pipeline devops automation,DevOps Engineer
riskanalysis investment finance excel modeling,Financial Analyst
figma designthinking uiux research usability,UI UX Designer
teammanagement riskmanagement projectplanning,Project Manager
media branding publicrelations communication,Public Relations Manager
ranking searchengine optimization seo,SEO Specialist
event management coordination,Event Manager
negotiation sales strategy businessdevelopment,Sales Manager
analytics traffic growth seo,SEO Specialist
design game levels,Game Designer
illustrator logo branding design graphics,Graphic Designer
mentalhealth therapy psychology,Psychologist
marketresearch report analysis,Research Analyst
communication customerservice,Customer Support Specialist
smartcontracts solidity ethereum blockchain,Blockchain Developer
management finance investment analysis portfolio,Financial Analyst
monitoring database sqlserver maintenance,Database Administrator
oop multithreading java jdbc collections spring backend,Software Engineer
marketing advertising googleads analytics,Digital Marketing Specialist
contentstrategy writing blogging editing seo,Content Writer
debugging linux systems git versioncontrol docker,Software Engineer
communication publicrelations branding,Public Relations Manager
layout design furniture,Interior Designer
design photoshop creativity branding illustrator,Graphic Designer
marketing seo socialmedia campaign,Digital Marketing Specialist
prototype figma uiux design userresearch,UI UX Designer
customer support service,Customer Support Specialist
marketing seo socialmedia advertising content,Marketing Manager
negotiation strategy businessdevelopment sales,Sales Manager
design architecture interior,Interior Designer
interior design planning,Interior Designer
fullstack react nodejs sql javascript frontend,Full Stack Developer
banking finance compliance credit loan,Banking Officer
ai neuralnetworks python tensorflow modeltraining,AI Engineer
server mongodb express api nodejs backend,Backend Developer
operations supplychain optimization,Operations Manager
banking financialanalysis finance portfolio investment,Financial Analyst
analytics advertising marketing googleads,Digital Marketing Specialist
ai tensorflow machinelearning modeling python neuralnetworks,Machine Learning Engineer
news media writing,Journalist
data research analysis,Research Analyst
modeldeployment ai deeplearning pytorch,AI Engineer
agile scrum projectmanagement,Project Manager
contentmarketing branding digitalmarketing seo,Digital Marketing Specialist
design animation creativity,Animator
analytics business reporting excel dataanalysis,Business Analyst
usability designthinking figma research uiux,UI UX Designer
creation content writing blogging editing,Content Writer
seo googleanalytics marketing content,SEO Specialist
tourism communication travel,Travel Consultant
planning marketresearch strategy branding growth,Marketing Manager
communication customerservice,Customer Support Specialist
writing blogging creativity storytelling editing,Content Writer
angular css frontend uiux html typescript,Frontend Developer
financialanalysis portfolio investment banking risk,Banking Officer
compliance services finance banking operations,Banking Officer
market planning reporting strategy analysis,Business Analyst
routing tcpip networking switching,Network Engineer
vpn protocols network networksecurity,Network Engineer
cyberlaw kali ethicalhacking security linux,Cybersecurity Analyst
agile scrum product planning roadmap,Product Manager
cloud devops kubernetes docker container automation,DevOps Engineer
management hr training recruitment performance,HR Manager
algorithms datastructures programming python debugging dsa oop,Software Engineer
siem malware forensics networksecurity threatanalysis,Cybersecurity Analyst
malware threatanalysis siem forensics networksecurity,Cybersecurity Analyst
economics research reporting,Economist
furniture design layout,Interior Designer
analysis psychology behavior,Psychologist
hiring training hr management recruitment,HR Manager
sql restapi backend microservices springboot java,Backend Developer
neuralnetworks tensorflow keras python deeplearning ai,Data Scientist
marketresearch strategy branding planning growth,Marketing Manager
marketresearch report analysis,Research Analyst
oop python algorithms dsa debugging datastructures programming,Software Engineer
ui design react frontend sass responsive,Frontend Developer
training teaching education,Teacher
animation unity physics game,Game Developer
communication publicrelations branding media,Public Relations Manager
planning hospitality service,Hotel Manager
contentstrategy writing blogging seo editing,Content Writer
productlifecycle roadmap strategy planning,Product Manager
pointers c++ memory optimization systems debugging programming,Software Engineer
graphics unity game development c#,Game Developer
portfolio finance banking investment financialanalysis,Financial Analyst
game development c++ graphics engine,Game Developer
database oracle security administration,Database Administrator
figma design uiux userexperience prototype,UI UX Designer
hr management recruitment hiring training,HR Manager
accounting finance taxation auditing tally,Banking Officer
design bootstrap javascript html figma css,Frontend Developer
kali cyberlaw linux security ethicalhacking,Cybersecurity Analyst
communication reputation media,Public Relations Manager
growth analytics traffic seo,SEO Specialist
uiux prototype design userresearch figma,UI UX Designer
frontend typescript angular html uiux css,Frontend Developer
recruitment management hiring hr training,HR Manager
supplychain distribution analysis,Supply Chain Manager
monitoring aws s3 ec2 cloud iam,Cloud Engineer
creativity editing video,Video Editor
datawarehouse analytics datamodeling etl sql,Data Engineer
analytics tableau reporting datavisualization sql python,Data Scientist
postgresql backup database recovery,Database Administrator
concurrency api backend microservices systems golang,Software Engineer
analytics growth traffic seo,SEO Specialist
spring java collections multithreading backend oop jdbc,Software Engineer
creation editing content writing blogging,Content Writer
docker ci/cd automation pipeline kubernetes devops,DevOps Engineer
neuralnetworks deeplearning tensorflow keras ai python,Data Scientist
acquisition hr hiring recruitment talent,HR Manager
excel reporting analytics dataanalysis business,Business Analyst
education teaching classroom,Teacher
startup growth businessdevelopment,Entrepreneur
web3 blockchain crypto security,Blockchain Developer
design game mechanics,Game Designer
monitoring database sqlserver maintenance,Database Administrator
branding communication media pressrelease,Public Relations Manager
businessdevelopment startup marketing,Entrepreneur
networking routing tcpip switching,Network Engineer
ci/cd pipeline kubernetes docker automation devops,DevOps Engineer
incidentresponse testing security firewall vulnerability,Cybersecurity Analyst
education teaching training,Teacher
riskanalysis finance investment banking excel,Banking Officer
design visual animation,Animator
story gamedesign mechanics,Game Designer
strategy reporting analysis market planning,Business Analyst
flutter ui dart development apps mobile,Mobile App Developer
blogging creation writing content editing,Content Writer
modeling riskanalysis investment finance excel,Financial Analyst
mongodb nodejs react fullstack api express,Full Stack Developer
gamedesign mechanics story,Game Designer
forecasting analysis economics,Economist
security firewall networking cybersecurity ethicalhacking linux,Cybersecurity Analyst
ai deeplearning python tensorflow machinelearning,AI Engineer
visual editing photography,Photographer
marketing publicrelations communication,Public Relations Manager
curriculum education teaching planning,Teacher
seo digitalmarketing branding contentmarketing,Digital Marketing Specialist
design game levels,Game Designer
logistics management planning operations,Operations Manager
smartcontracts ethereum blockchain solidity,Blockchain Developer
documentation business modeling process analysis,Business Analyst
pytorch neuralnetworks training learning deep ai,Machine Learning Engineer
management planning operations logistics,Operations Manager
counselling behavior therapy psychology,Psychologist
modeling sklearn algorithms ai python ml,Machine Learning Engineer
ml modeling sklearn ai python algorithms,Machine Learning Engineer
blogging creation editing writing content,Content Writer
algorithms debugging datastructures programming python dsa oop,Software Engineer
ai learning training deep pytorch neuralnetworks,Machine Learning Engineer
banking finance investment financialanalysis portfolio,Financial Analyst
service hospitality management,Hotel Manager
pytorch modeldeployment ai deeplearning,AI Engineer
accounting tally taxation auditing finance,Banking Officer
spaceplanning design decor,Interior Designer
visual photography editing,Photographer
operations services finance compliance banking,Banking Officer
journalism news reporting writing,Journalist
data research analysis,Research Analyst
gamedesign creativity concept,Game Designer
research report dataanalysis,Research Analyst
creativity video editing,Video Editor
performance database sql mysql optimization,Database Administrator
banking financialanalysis risk investment portfolio,Banking Officer
database backup postgresql recovery,Database Administrator
motion aftereffects videoediting,Video Editor
research statistics analysis,Research Analyst
roadmap management strategy analytics productplanning,Product Manager
datawarehouse datamodeling sql analytics etl,Data Engineer
security firewall networking linux cybersecurity ethicalhacking,Cybersecurity Analyst
design planning interior,Interior Designer
ai machinelearning python deeplearning tensorflow,AI Engineer
design interior creativity,Interior Designer
management portfolio investment finance analysis,Financial Analyst
innovation strategy business,Entrepreneur
leadership management entrepreneurship,Entrepreneur
eventmanagement budget planning,Event Manager
analysis news reporting,Journalist
solidity smartcontracts web3 ethereum,Blockchain Developer
node mongodb react fullstack mern express,Full Stack Developer
advertising googleads marketing analytics,Digital Marketing Specialist
marketing publicrelations communication,Public Relations Manager
tourism planning travel,Travel Consultant
communication education presentation teaching,Teacher
