skills,career
seo ranking optimization searchengine,SEO Specialist
deployment networking azure devops cloud linux,Cloud Engineer
supplychain logistics planning,Supply Chain Manager
performance optimization sql database mysql,Database Administrator
googleads advertising analytics marketing,Digital Marketing Specialist
interior creativity design,Interior Designer
legalresearch law caseanalysis,Lawyer
infrastructure lan network wan,Network Engineer
salesstrategy communication targets marketing,Sales Manager
support customer service,Customer Support Specialist
analysis research statistics,Research Analyst
interior design architecture,Interior Designer
photography editing creativity,Photographer
flask docker postgresql backend api python,Backend Developer
documentation requirements analysis communication stakeholder,Business Analyst
wireframe prototype design figma uiux,Graphic Designer
reporting sql datavisualization analytics python tableau,Data Scientist
systems optimization memory debugging pointers c++ programming,Software Engineer
design uiux figma wireframe prototype,UI UX Designer
customer hospitality management,Hotel Manager
decor spaceplanning design,Interior Designer
ethereum solidity web3 smartcontracts,Blockchain Developer
planning strategy reporting analytics business,Business Analyst
development planning product marketresearch strategy,Product Manager
typography creativity canva layout poster,Graphic Designer
blogging storytelling creativity writing editing,Content Writer
prototype uiux design figma userexperience,UI UX Designer
pytorch ai python nlp transformers,AI Engineer
levels design game,Game Designer
sql microservices java restapi backend springboot,Backend Developer
frontend database fullstack backend api development,Full Stack Developer
seo socialmedia marketing campaign,Digital Marketing Specialist
etl analytics datamodeling sql datawarehouse,Data Engineer
finance banking loan compliance credit,Banking Officer
android mobile apps kotlin development,Mobile App Developer
planning design interior,Interior Designer
recruitment hr management hiring training,HR Manager
tensorflow ai modeltraining python ml,Machine Learning Engineer
systems docker versioncontrol debugging linux git,Software Engineer
hotel management operations,Hotel Manager
mern react express mongodb node fullstack,Full Stack Developer
programming systems debugging c++ pointers memory optimization,Software Engineer
process documentation modeling analysis business,Business Analyst
reporting research economics,Economist
caseanalysis legalresearch law,Lawyer
ci/cd automation pipeline devops cloud terraform,DevOps Engineer
vue api css axios frontend javascript,Frontend Developer
videoediting editing premiere,Video Editor
management operations hotel,Hotel Manager
management process operations,Operations Manager
wan lan network infrastructure,Network Engineer
web3 security blockchain crypto,Blockchain Developer
budget eventmanagement planning,Event Manager
design bootstrap css html javascript figma,Frontend Developer
visualization sklearn seaborn python analytics matplotlib,Data Scientist
legalresearch caseanalysis law,Lawyer
aws terraform docker linux cloud kubernetes devops,Cloud Engineer
seo optimization marketing backlinks,SEO Specialist
planning logistics operations analysis,Operations Manager
research analysis data,Research Analyst
customer planning travel,Travel Consultant
editing video storytelling,Video Editor
automation pipeline docker jenkins devops cloud,Cloud Engineer
negotiation closing deals sales leadgeneration,Sales Manager
express nodejs api server mongodb backend,Backend Developer
statistics numpy python pandas dataanalysis machinelearning,Data Scientist
businessdevelopment negotiation strategy sales,Sales Manager
automation monitoring scripting infrastructure linux devops,DevOps Engineer
management operations process,Operations Manager
relations sales strategy customer marketing,Sales Manager
video editing production,Video Editor
design creativity animation,Animator
roadmap productlifecycle strategy planning,Product Manager
productplanning analytics roadmap strategy management,Product Manager
opencv ai deeplearning computervision,AI Engineer
ethereum solidity blockchain smartcontracts,Blockchain Developer
ai transformers nlp pytorch python,AI Engineer
communication media reputation,Public Relations Manager
jenkins cloud pipeline automation docker deployment,DevOps Engineer
devops automation cloud container kubernetes docker,DevOps Engineer
contracts law negotiation,Lawyer
gamedesign concept creativity,Game Designer
banking risk financialanalysis portfolio investment,Banking Officer
datavisualization tableau python reporting sql analytics,Data Scientist
research report dataanalysis,Research Analyst
development game graphics c# unity,Game Developer
travel planning tourism,Travel Consultant
ethereum solidity development blockchain,Blockchain Developer
siem malware networksecurity threatanalysis forensics,Cybersecurity Analyst
organization event communication,Event Manager
communication reporting journalism,Journalist
strategy operations management,Operations Manager
solidity blockchain development ethereum,Blockchain Developer
camera photoshoot lighting,Photographer
innovation business startup strategy,Entrepreneur
mentalhealth psychology therapy,Psychologist
seo campaign marketing socialmedia,Digital Marketing Specialist
analytics reporting excel dataanalysis business,Business Analyst
agile roadmap product planning scrum,Product Manager
investment banking riskanalysis finance excel,Banking Officer
marketresearch planning strategy branding growth,Marketing Manager
management eventplanning coordination,Event Manager
marketing communication publicrelations,Public Relations Manager
editing visual photography,Photographer
marketing content googleanalytics seo,SEO Specialist
teaching education training,Teacher
linux azure devops cloud networking deployment,Cloud Engineer
report analysis marketresearch,Research Analyst
tensorflow modeltraining python neuralnetworks ai,AI Engineer
s3 monitoring aws iam cloud ec2,Cloud Engineer
pipeline devops jenkins cloud docker automation,Cloud Engineer
entrepreneurship leadership management,Entrepreneur
python api authentication django backend sql,Backend Developer
design css figma html javascript bootstrap,Frontend Developer
support service customer,Customer Support Specialist
analysis research economics,Economist
socialmedia marketing content strategy,Digital Marketing Specialist
c# animation unity ui game,Game Developer
devops cloud terraform pipeline ci/cd automation,DevOps Engineer
photography editing creativity,Photographer
supplychain management inventory,Supply Chain Manager
finance portfolio investment banking financialanalysis,Financial Analyst
finance banking investment riskanalysis excel,Banking Officer
pipeline cloud jenkins automation deployment docker,DevOps Engineer
database backup postgresql recovery,Database Administrator
communication customerservice,Customer Support Specialist
branding communication pressrelease media,Public Relations Manager
stakeholder scrum planning management,Project Manager
illustrator branding logo graphics design,Graphic Designer
game ui animation unity c#,Game Developer
reputation media communication,Public Relations Manager
machinelearning neuralnetworks modeling tensorflow python ai,Machine Learning Engineer
marketing strategy campaign analytics sales branding,Marketing Manager
communication branding publicrelations,Public Relations Manager
linux ethicalhacking firewall cybersecurity networking security,Cybersecurity Analyst
inventory management supplychain,Supply Chain Manager
management hospitality customer,Hotel Manager
contracts litigation legalresearch law,Lawyer
css figma bootstrap design javascript html,Frontend Developer
editing photography visual,Photographer
analytics campaign branding strategy digitalmarketing,Marketing Manager
backend development database api frontend fullstack,Full Stack Developer
creation writing content blogging editing,Content Writer
ai pytorch modeldeployment deeplearning,AI Engineer
sklearn ml ai python algorithms modeling,Machine Learning Engineer
project communication planning leadership,Project Manager
cloud monitoring ec2 aws iam s3,Cloud Engineer
event logistics planning,Event Manager
behavior psychology analysis,Psychologist
prototype figma design uiux userresearch,UI UX Designer
development apps flutter ui mobile dart,Mobile App Developer
ai opencv computervision deeplearning,AI Engineer
management entrepreneurship leadership,Entrepreneur
banking excel riskanalysis investment finance,Banking Officer
tableau python analytics datavisualization sql reporting,Data Scientist
numpy python machinelearning pandas dataanalysis statistics,Data Scientist
creativity concept gamedesign,Game Designer
banking finance services operations compliance,Banking Officer
management operations strategy,Operations Manager
investigation reporting media,Journalist
sklearn python visualization matplotlib analytics seaborn,Data Scientist
strategy operations management,Operations Manager
banking credit loan compliance finance,Banking Officer
video editing creativity,Video Editor
graphics animation motion,Animator
video editing production,Video Editor
hadoop spark etl sql datawarehouse python,Data Engineer
swift apps mobile apple ios development,Mobile App Developer
security vulnerability incidentresponse firewall testing,Cybersecurity Analyst
security kali ethicalhacking linux cyberlaw,Cybersecurity Analyst
investment modeling riskanalysis excel finance,Financial Analyst
strategy marketing content socialmedia,Digital Marketing Specialist
java apps android development studio mobile,Mobile App Developer
indexing optimization database query,Database Administrator
editing creativity photography,Photographer
design html figma javascript bootstrap css,Frontend Developer
tally auditing accounting finance taxation,Banking Officer
hadoop processing bigdata etl spark data,Data Engineer
management customer hospitality,Hotel Manager
videoediting premiere editing,Video Editor
sql analytics tableau python reporting datavisualization,Data Scientist
news reporting analysis,Journalist
optimization database performance sql mysql,Database Administrator
branding publicrelations media communication,Public Relations Manager
api mongodb server backend express nodejs,Backend Developer
maintenance database monitoring sqlserver,Database Administrator
network infrastructure lan wan,Network Engineer
management tourism travel,Travel Consultant
court law legal argument,Lawyer
event coordination management,Event Manager
organization communication event,Event Manager
operations planning analysis logistics,Operations Manager
frontend api backend development database fullstack,Full Stack Developer
analytics sales branding campaign strategy marketing,Marketing Manager
express api nodejs backend server mongodb,Backend Developer
accounting budgeting analysis finance financialreporting,Financial Analyst
booking planning tourism,Travel Consultant
mobile android apps kotlin development,Mobile App Developer
research statistics analysis,Research Analyst
agile projectmanagement scrum,Project Manager
operations strategy management,Operations Manager
hospitality management service,Hotel Manager
design animation visual,Animator
production editing video,Video Editor
motion videoediting aftereffects,Video Editor
projectplanning teammanagement riskmanagement,Project Manager
pipeline jenkins automation cloud devops docker,Cloud Engineer
smartcontracts solidity ethereum blockchain,Blockchain Developer
finance banking investment financialanalysis portfolio,Financial Analyst
mern react fullstack mongodb node express,Full Stack Developer
communication sales negotiation targets presentation,Sales Manager
communication problem support,Customer Support Specialist
riskmanagement teammanagement projectplanning,Project Manager
branding pressrelease communication media,Public Relations Manager
planning booking tourism,Travel Consultant
camera photography editing,Photographer
contracts law negotiation,Lawyer
keywords analytics seo content,SEO Specialist
branding strategy analytics digitalmarketing campaign,Marketing Manager
solidity web3 smartcontracts ethereum,Blockchain Developer
apps mobile ui reactnative javascript,Mobile App Developer
contentmarketing branding seo digitalmarketing,Digital Marketing Specialist
transformers python ai nlp pytorch,AI Engineer
project leadership communication planning,Project Manager
negotiation presentation targets communication sales,Sales Manager
collections backend java spring oop multithreading jdbc,Software Engineer
linux infrastructure monitoring automation devops scripting,DevOps Engineer
communication teaching education presentation,Teacher
datamodeling datawarehouse sql analytics etl,Data Engineer
dataanalysis analytics excel reporting business,Business Analyst
backend python sql authentication django api,Backend Developer
ethereum blockchain solidity smartcontracts,Blockchain Developer
presentation negotiation communication targets sales,Marketing Manager
traffic seo growth analytics,SEO Specialist
mentalhealth therapy psychology,Psychologist
riskanalysis finance excel investment banking,Banking Officer
video editing storytelling,Video Editor
c++ unreal design game 3d,Game Developer
event management coordination,Event Manager
excel business analytics reporting dataanalysis,Business Analyst
teaching training education,Teacher
sass design react responsive frontend ui,Frontend Developer
springboot sql backend restapi java microservices,Backend Developer
network wan infrastructure lan,Network Engineer
content socialmedia marketing strategy,Digital Marketing Specialist
prototype userexperience uiux figma design,UI UX Designer
computervision opencv deeplearning ai,AI Engineer
management productplanning strategy analytics roadmap,Product Manager
seo traffic growth analytics,SEO Specialist
creativity storytelling writing editing blogging,Content Writer
mongodb fullstack mern express react node,Full Stack Developer
figma uiux design prototype userresearch,UI UX Designer
investigation media reporting,Journalist
finance budgeting financialreporting accounting analysis,Financial Analyst
backend sql css javascript flask html,Full Stack Developer
growth seo traffic analytics,SEO Specialist
media writing news,Journalist
operations process management,Operations Manager
management event coordination,Event Manager
layout design furniture,Interior Designer
crypto blockchain web3 security,Blockchain Developer
targets sales negotiation communication presentation,Marketing Manager
recruitment hiring training management hr,HR Manager
administration oracle security database,Database Administrator
media communication reputation,Public Relations Manager
editing video production,Video Editor
figma design css javascript bootstrap html,Frontend Developer
communication customerservice,Customer Support Specialist
data analysis research,Research Analyst
ai nlp pytorch python transformers,AI Engineer
news media writing,Journalist
legal court law argument,Lawyer
scrum planning management stakeholder,Project Manager
etl datawarehouse spark hadoop sql python,Data Engineer
ai deeplearning python keras neuralnetworks tensorflow,Data Scientist
design furniture layout,Interior Designer
r dataanalysis statistics modeling analytics visualization,Data Scientist
nodejs frontend react fullstack javascript sql,Full Stack Developer
recruitment performance training management hr,HR Manager
communication organization event,Event Manager
communication travel tourism,Travel Consultant
protocols vpn network networksecurity,Network Engineer
analysis penetrationtesting monitoring linux security,Cybersecurity Analyst
prototype uiux design wireframe figma,Graphic Designer
creativity gamedesign concept,Game Designer
service hospitality management,Hotel Manager
content socialmedia strategy marketing,Digital Marketing Specialist
creativity interior design,Interior Designer
businessdevelopment startup marketing,Entrepreneur
planning operations logistics management,Operations Manager
research reporting economics,Economist
management training hr recruitment hiring,HR Manager
mongodb api express backend server nodejs,Backend Developer
socialmedia strategy content marketing,Digital Marketing Specialist
caseanalysis law legalresearch,Lawyer
design game concept,Game Designer
productlifecycle roadmap strategy planning,Product Manager
contentstrategy editing blogging seo writing,Content Writer
communication salesstrategy marketing targets,Sales Manager
blockchain ethereum development solidity,Blockchain Developer
finance compliance credit banking loan,Banking Officer
api mongodb express server nodejs backend,Backend Developer
development flutter dart mobile apps ui,Mobile App Developer
planning design interior,Interior Designer
sales marketing strategy branding campaign analytics,Marketing Manager
analysis economicresearch policy,Economist
banking portfolio financialanalysis investment risk,Banking Officer
mysql php backend laravel api server,Backend Developer
docker git linux systems debugging versioncontrol,Software Engineer
siem networksecurity malware forensics threatanalysis,Cybersecurity Analyst
security cyberlaw ethicalhacking kali linux,Cybersecurity Analyst
economics reporting research,Economist
litigation legalwriting law,Lawyer
startup innovation business strategy,Entrepreneur
targets presentation negotiation sales communication,Sales Manager
figma design wireframe uiux prototype,Graphic Designer
branding publicrelations media communication,Public Relations Manager
cloud docker pipeline jenkins deployment automation,DevOps Engineer
writing storytelling article editing blogging,Content Writer
react frontend design responsive ui sass,Frontend Developer
budget planning eventmanagement,Event Manager
web3 blockchain crypto security,Blockchain Developer
hr training employee management engagement,HR Manager
modeling statistics analytics r dataanalysis visualization,Data Scientist
kotlin mobile development android apps,Mobile App Developer
customerservice communication,Customer Support Specialist
sql python datawarehouse etl spark hadoop,Data Engineer
backlinks marketing seo optimization,SEO Specialist
communication education learning,Teacher
creativity concept gamedesign,Game Designer
frontend html uiux typescript css angular,Frontend Developer
dataanalysis research report,Research Analyst
stakeholder communication requirements analysis documentation,Business Analyst
backend springboot microservices restapi java sql,Backend Developer
report marketresearch analysis,Research Analyst
visual design animation,Animator
analysis research economics,Economist
analysis psychology behavior,Psychologist
frontend ui responsive design react sass,Frontend Developer
camera editing photography,Photographer
seo marketing googleanalytics content,SEO Specialist
compliance credit banking finance loan,Banking Officer
stakeholder management scrum planning,Project Manager
research dataanalysis report,Research Analyst
research statistics analysis,Research Analyst
mysql sql optimization database performance,Database Administrator
deployment devops azure cloud linux networking,Cloud Engineer
operations strategy management,Operations Manager
dataanalysis numpy python statistics machinelearning pandas,Data Scientist
vulnerability incidentresponse security firewall testing,Cybersecurity Analyst
kali ethicalhacking linux cyberlaw security,Cybersecurity Analyst
interior creativity design,Interior Designer
sql reporting analytics datavisualization tableau python,Data Scientist
agile projectmanagement scrum,Project Manager
apps mobile reactnative javascript ui,Mobile App Developer
court law argument legal,Lawyer
mentalhealth therapy psychology,Psychologist
cyberlaw linux kali ethicalhacking security,Cybersecurity Analyst
tourism booking planning,Travel Consultant
marketing customer relations strategy sales,Sales Manager
policies hr relations employee training,HR Manager
storyboard design animation,Animator
unity game graphics development c#,Game Developer
travel planning tourism,Travel Consultant
policies relations hr employee training,HR Manager
editing video storytelling,Video Editor
api express react fullstack mongodb nodejs,Full Stack Developer
storytelling blogging article writing editing,Content Writer
figma userexperience design prototype uiux,UI UX Designer
business strategy innovation,Entrepreneur
datawarehouse datamodeling analytics sql etl,Data Engineer
usability figma research uiux designthinking,UI UX Designer
visual editing photography,Photographer
writing news reporting journalism,Journalist
customerservice communication,Customer Support Specialist
eventmanagement planning budget,Event Manager
opencv computervision deeplearning ai,AI Engineer
python modeltraining ai tensorflow ml,Machine Learning Engineer
process operations management,Operations Manager
communication support problem,Customer Support Specialist
research economics reporting,Economist
strategy businessdevelopment negotiation sales,Sales Manager
python sklearn ml algorithms ai modeling,Machine Learning Engineer
unity c# development graphics game,Game Developer
court law argument legal,Lawyer
statistics analysis research,Research Analyst
travel tourism communication,Travel Consultant
security analysis linux monitoring penetrationtesting,Cybersecurity Analyst
development mobile android apps kotlin,Mobile App Developer
psychology counselling research,Psychologist
premiere editing videoediting,Video Editor
publicrelations communication branding,Public Relations Manager
security firewall vulnerability incidentresponse testing,Cybersecurity Analyst
management customer hospitality,Hotel Manager
development mobile ios apps apple swift,Mobile App Developer
management hr training performance recruitment,HR Manager
media reputation communication,Public Relations Manager
creativity concept gamedesign,Game Designer
strategy roadmap stakeholder agile product,Product Manager
productplanning management roadmap analytics strategy,Product Manager
python tensorflow ai machinelearning deeplearning,AI Engineer
operations logistics planning,Supply Chain Manager
development solidity blockchain ethereum,Blockchain Developer
ai python ml tensorflow modeltraining,Machine Learning Engineer
interior planning design,Interior Designer
communication problem support,Customer Support Specialist
classroom teaching education,Teacher
defi blockchain solidity crypto web3,Blockchain Developer
tourism planning travel,Travel Consultant
operations management planning logistics,Operations Manager
gamedesign creativity concept,Game Designer
supplychain planning logistics,Supply Chain Manager
targets negotiation sales communication presentation,Marketing Manager
motion videoediting aftereffects,Video Editor
forecasting economics analysis,Economist
cloud automation deployment docker jenkins pipeline,DevOps Engineer
security web3 blockchain crypto,Blockchain Developer
deeplearning computervision opencv ai,AI Engineer
vulnerability testing firewall security incidentresponse,Cybersecurity Analyst
service hospitality planning,Hotel Manager
innovation startup strategy business,Entrepreneur
startup marketing businessdevelopment,Entrepreneur
tourism travel communication,Travel Consultant
management coordination event,Event Manager
organization event communication,Event Manager
editing blogging seo contentstrategy writing,Content Writer
creativity editing video,Video Editor
counselling research psychology,Psychologist
switching networking tcpip routing,Network Engineer
react mern fullstack mongodb express node,Full Stack Developer
management leadership entrepreneurship,Entrepreneur
etl datawarehouse sql analytics datamodeling,Data Engineer
vue axios api frontend css javascript,Frontend Developer
stakeholder requirements communication documentation analysis,Business Analyst
mobile javascript reactnative apps ui,Mobile App Developer
writing copywriting marketing blogging content,Content Writer
production video editing,Video Editor
neuralnetworks ai tensorflow python deeplearning keras,Data Scientist
reporting market analysis strategy planning,Business Analyst
budget eventmanagement planning,Event Manager
kali security cyberlaw ethicalhacking linux,Cybersecurity Analyst
storytelling video editing,Video Editor
video editing creativity,Video Editor
planning project leadership communication,Project Manager
planning service hospitality,Hotel Manager
design uiux prototype interaction wireframe,UI UX Designer
development android apps mobile kotlin,Mobile App Developer
camera composition photography,Photographer
microservices springboot restapi sql java backend,Backend Developer
digitalmarketing analytics campaign strategy branding,Marketing Manager
marketing salesstrategy targets communication,Sales Manager
psychology analysis behavior,Psychologist
mechanics story gamedesign,Game Designer
agile product planning roadmap scrum,Product Manager
seo marketing growth analytics,Digital Marketing Specialist
relations hr training policies employee,HR Manager
networksecurity vpn protocols network,Network Engineer
planning strategy marketresearch development product,Product Manager
leadgeneration negotiation closing deals sales,Sales Manager
event planning logistics,Event Manager
javascript css flask backend sql html,Full Stack Developer
editing storytelling blogging creativity writing,Content Writer
analytics growth seo traffic,SEO Specialist
ranking seo optimization searchengine,SEO Specialist
tensorflow python modeltraining neuralnetworks ai,AI Engineer
management strategy roadmap analytics productplanning,Product Manager
logistics analysis operations planning,Operations Manager
interior design creativity,Interior Designer
marketing businessdevelopment startup,Entrepreneur
